{
  "schema_version": 1,
  "updated_at": "2026-10-28T18:50:58Z",
  "character": {
    "name": "Alice",
    "title": "Simon's wife",
    "calling": "From the south coast",
    "origin": "A terraced house a few streets from the sea, on England's south coast",
    "look": "Dark coat, sensible boots"
  },
  "resolve": {
    "current": 9,
    "max": 9
  },
  "conditions": [],
  "witchlight": {
    "current": 0,
    "max": 0,
    "recovery": "A night's sleep, or a quiet hour with the cats"
  },
  "powers": [
    {
      "name": "Point and Wish",
      "kind": "power",
      "status": "locked",
      "description": "Sometimes, when she points at something, it seems to lean towards her finger."
    },
    {
      "name": "Rhyme Spells",
      "kind": "power",
      "status": "locked",
      "description": "A rhyme from her aunts' book keeps turning up in her head, uninvited."
    },
    {
      "name": "Glamour",
      "kind": "power",
      "status": "locked",
      "description": "In shop windows, just for a moment, she sometimes catches a different face."
    },
    {
      "name": "Mirror Sight",
      "kind": "power",
      "status": "locked",
      "description": "Mirrors sometimes seem to hold on to a moment a little too long."
    },
    {
      "name": "Touchstone",
      "kind": "power",
      "status": "locked",
      "description": "Some things feel warm, or cold, as if someone has only just let go of them."
    },
    {
      "name": "Cat's Eyes",
      "kind": "bond",
      "status": "locked",
      "description": "The cats always seem to know exactly where she is. Perhaps she could know where they are."
    },
    {
      "name": "Witch's Sight",
      "kind": "talent",
      "status": "active",
      "description": "Since the night Simon vanished, Alice notices what's hidden by magic: glamours, wards, and doors other people walk straight past."
    },
    {
      "name": "Sharp Eye",
      "kind": "talent",
      "status": "active",
      "description": "When numbers, times or stories don't add up, Alice feels it before she can say why."
    },
    {
      "name": "Stop the clock",
      "kind": "power",
      "status": "locked",
      "description": "Once, when a glass slipped from her hand, it hung in the air for a heartbeat before it fell."
    },
    {
      "name": "Cats who talk back",
      "kind": "bond",
      "status": "locked",
      "description": "Lately Suki looks at her as if she has a great deal to say."
    },
    {
      "name": "The name that answers",
      "kind": "power",
      "status": "locked",
      "description": "Something stirs whenever a stranger says Simon's name."
    }
  ],
  "case": {
    "title": "The disappearance of Simon",
    "day": 1,
    "summary": "Simon is gone. His coat, shoes, keys and phone are all still here, his tea is still warm, and the house is empty. A few weeks ago he hung an old paper lantern from the beach in his study window, and he's been hearing singing at night ever since.",
    "questions": [
      "Where is Simon? He left without his coat, shoes, keys or phone.",
      "Where did the lantern come from, and who is singing?",
      "What did Aunt Prue know about lanterns that come over the water?",
      "Where is Bar Kurage, and why does Simon's coat have its matchbook?",
      "Why is the lantern singing Simon's name?",
      "Who took Simon through a mirror, and where does the cold light lead?",
      "What does it mean to 'keep the light' in Yūgure?",
      "Why are the lanterns of Yūgure turning cold and white?"
    ],
    "clues": [
      {
        "title": "The lantern from the beach",
        "text": "After the storm, Simon found an old paper lantern in the shingle, dry as a bone, printed with characters neither of them can read. He hung it in his study window.",
        "source": "Simon",
        "status": "new"
      },
      {
        "title": "Singing in the night",
        "text": "Since the lantern came, Simon has slept badly. He says he hears a woman singing in the study late at night, and once joked that the lantern had lit itself.",
        "source": "Simon",
        "status": "new"
      },
      {
        "title": "Still-warm tea",
        "text": "Simon's study: his chair pushed back, his tea still warm in his green frog mug, his phone face down beside it. No sign of a struggle. Every room in the house is empty.",
        "source": "Home: the study",
        "status": "new"
      },
      {
        "title": "A line he never typed",
        "text": "On Simon's laptop, one line of curling characters repeats down the screen, top to bottom, and keeps adding more. They look like the writing on the lantern.",
        "source": "Simon's laptop",
        "status": "new"
      },
      {
        "title": "Aunt Prue's letter",
        "text": "Tucked in a box in the loft: 'If a lantern ever comes to your window over the water, it is not a gift, it is a summons. Don't let anyone answer it who isn't ready to go. Ring me.' Signed Prue, with a phone number.",
        "source": "Home: the loft",
        "status": "new"
      },
      {
        "title": "A matchbook from nowhere",
        "text": "In Simon's coat pocket: a matchbook printed with a glowing jellyfish and 'Bar Kurage, 3rd Canal Street, Yūgure'. Alice has never heard of the place, and Simon never smoked.",
        "source": "Simon's coat",
        "status": "new"
      },
      {
        "title": "Simon's phone",
        "text": "His passcode is Alice's birthday. Nothing to hide in his messages. His searches and notes show weeks of trying to explain the lantern: a photo of a star-in-a-circle mark on its base, 'sleep paralysis singing', 'paper lantern writing'. A note from 4 a.m.: the woman sings the same few lines and 'sounds like she's waiting'. At 7:36 tonight he started a text to Alice and never sent it: 'I think I know what she's singing. It's my name.'",
        "source": "Simon's phone",
        "status": "key"
      },
      {
        "title": "The line is a song, written down",
        "text": "Aunt Prue, hearing it described: the characters stack into a lantern because it's a calling-song, written so a lantern can read it back. A lantern calls whoever it has chosen by name. Prue says phones won't work on the other side of the door.",
        "source": "Aunt Prue, by phone",
        "status": "following"
      },
      {
        "title": "The lantern sings Simon's name",
        "text": "When the lantern in the study window glowed, Alice heard a woman's voice sing three low lines, and in the middle of them, Simon's name.",
        "source": "The study lantern",
        "status": "key"
      },
      {
        "title": "The singing woman, Oharu",
        "text": "Lit with a Bar Kurage match, the lantern shows a woman in a faded blue kimono, hair wet, standing in the study window glass. She calls herself Oharu. She sang Simon home, but he never arrived. 'A cold light took him, and it came from a mirror.'",
        "source": "The study lantern",
        "status": "key"
      },
      {
        "title": "Why Simon",
        "text": "Oharu says the lantern was sent over the water to find someone who will 'keep the light' for a city called Yūgure, and that it chose Simon. She was meant to sing him home along the lantern road. She doesn't know who took him, only that he is alive, far away and cold.",
        "source": "Oharu",
        "status": "key"
      },
      {
        "title": "The cold white lanterns",
        "text": "Here and there in Yūgure, one lantern burns a cold white among the gold ones. A pharmacist on 3rd Canal Street says they began a month ago, creeping in from the outer districts, 'where the dusk is thinning'. People don't like to touch them.",
        "source": "The pharmacy on 3rd Canal Street",
        "status": "following"
      }
    ],
    "people": [
      {
        "name": "Simon",
        "role": "Alice's husband, software developer, early forties",
        "stance": "missing",
        "icon": "🧑‍💻",
        "notes": "Gone from the house without his coat, shoes, keys or phone."
      },
      {
        "name": "Aunt Prue",
        "role": "Alice's aunt, the last of the family witches",
        "stance": "contact",
        "icon": "☎️",
        "notes": "Answered after nine rings. 'So it's come, then.' Knows about lanterns from over the water, won't say everything on the phone. Her number: 01637 555 0142."
      },
      {
        "name": "Oharu",
        "role": "The woman who sings in the lantern",
        "stance": "contact",
        "icon": "🏮",
        "notes": "A ghost in a faded blue kimono, wet hair, carrying a twin of the study lantern. The lantern's voice: she was meant to sing Simon home. Wants to find him."
      },
      {
        "name": "Mrs Nakagawa",
        "role": "Pharmacist on 3rd Canal Street",
        "stance": "neutral",
        "icon": "💊",
        "notes": "Brisk and wary. Hung up a lantern she says she didn't light."
      }
    ],
    "places": [
      {
        "name": "Home",
        "notes": "A terraced house a few streets from the sea. Where Simon was last seen.",
        "status": "visited"
      },
      {
        "name": "Bar Kurage",
        "notes": "3rd Canal Street. Alice has seen its violet jellyfish glow at the far end of the street, past the noodle cart, by the canal bridge.",
        "status": "unvisited"
      },
      {
        "name": "The Old Shrine Hill",
        "notes": "Where Oharu says the lantern road should have taken Simon, in Yūgure.",
        "status": "unvisited"
      },
      {
        "name": "Yūgure",
        "notes": "The city on the other side of the garden door. A back alley, rain, neon, a long way from the south coast.",
        "status": "visited"
      }
    ]
  },
  "inventory": {
    "money": [
      {
        "label": "Pounds sterling",
        "amount": "£46.20"
      }
    ],
    "items": [
      {
        "name": "Hand mirror",
        "qty": 1,